{
  "protocol_version": 1,
  "base_revision": 1,
  "base_hash": "aaaaaaaaaaaaaaaaaaaaaaaaaaaaaaaaaaaaaaaaaaaaaaaaaaaaaaaaaaaaaaaa",
  "changes": [
    {
      "operation": "add_library_entry",
      "section_id": "target-experience",
      "entry_id": "tailored-entry-1",
      "library_entry_id": "library-1",
      "source_row_id": "library-row-1",
      "reason": "Use the relevant verified experience as the basis for this CV.",
      "evidence": [
        {
          "source": "library",
          "field_path": "*",
          "library_entry_id": "library-1",
          "source_row_id": "library-row-1",
          "source_hash": "dddddddddddddddddddddddddddddddddddddddddddddddddddddddddddddddd"
        }
      ]
    },
    {
      "operation": "replace_description",
      "section_id": "target-experience",
      "entry_id": "tailored-entry-1",
      "value": "Built dependable backend services.",
      "reason": "Emphasize the reliability requirement without adding a new factual claim.",
      "evidence": [
        {
          "source": "library",
          "field_path": "description",
          "library_entry_id": "library-1",
          "source_row_id": "library-row-1",
          "source_hash": "dddddddddddddddddddddddddddddddddddddddddddddddddddddddddddddddd"
        }
      ]
    },
    {
      "operation": "report_gap",
      "requirement": "Kubernetes",
      "reason": "No supporting evidence exists in the packet."
    }
  ]
}
